{
  "$schema": "https://json-schema.org/draft/2020-12/schema",
  "$id": "https://github.com/zyx-corporation/openayane-rde/schemas/structural_diff.schema.json",
  "title": "StructuralDiff",
  "type": "object",
  "required": [
    "diff_id",
    "contract_id",
    "domain",
    "changed_nodes",
    "added_nodes",
    "deleted_nodes",
    "moved_nodes",
    "protected_element_changes",
    "schema_violations",
    "signature_changes",
    "reference_breaks",
    "self_report_mismatches",
    "diff_confidence",
    "created_at"
  ],
  "properties": {
    "diff_id": { "type": "string" },
    "contract_id": { "type": "string" },
    "domain": {
      "type": "string",
      "enum": ["markdown", "json", "python", "generic"]
    },
    "changed_nodes": {
      "type": "array",
      "items": { "$ref": "#/$defs/diff_node" }
    },
    "added_nodes": {
      "type": "array",
      "items": { "$ref": "#/$defs/diff_node" }
    },
    "deleted_nodes": {
      "type": "array",
      "items": { "$ref": "#/$defs/diff_node" }
    },
    "moved_nodes": {
      "type": "array",
      "items": { "$ref": "#/$defs/diff_node" }
    },
    "protected_element_changes": {
      "type": "array",
      "items": { "$ref": "#/$defs/protected_change" }
    },
    "schema_violations": {
      "type": "array",
      "items": { "$ref": "#/$defs/violation" }
    },
    "signature_changes": {
      "type": "array",
      "items": { "$ref": "#/$defs/diff_node" }
    },
    "reference_breaks": {
      "type": "array",
      "items": { "$ref": "#/$defs/violation" }
    },
    "self_report_mismatches": {
      "type": "array",
      "items": { "$ref": "#/$defs/self_report_mismatch" }
    },
    "diff_confidence": {
      "type": "number",
      "minimum": 0.0,
      "maximum": 1.0
    },
    "metadata": {
      "type": "object",
      "additionalProperties": true
    },
    "created_at": {
      "type": "string",
      "format": "date-time"
    }
  },
  "$defs": {
    "diff_node": {
      "type": "object",
      "required": ["path", "kind", "before", "after", "description"],
      "properties": {
        "path": { "type": "string" },
        "kind": { "type": "string" },
        "before": {},
        "after": {},
        "description": { "type": "string" },
        "risk_hint": {
          "type": "string",
          "enum": ["low", "medium", "high", "critical", "unknown"]
        }
      },
      "additionalProperties": true
    },
    "protected_change": {
      "type": "object",
      "required": ["element", "path", "change_type", "description"],
      "properties": {
        "element": { "type": "string" },
        "path": { "type": "string" },
        "change_type": {
          "type": "string",
          "enum": ["changed", "added", "deleted", "moved"]
        },
        "description": { "type": "string" },
        "risk_hint": {
          "type": "string",
          "enum": ["low", "medium", "high", "critical", "unknown"]
        }
      },
      "additionalProperties": false
    },
    "violation": {
      "type": "object",
      "required": ["path", "violation_type", "description"],
      "properties": {
        "path": { "type": "string" },
        "violation_type": { "type": "string" },
        "description": { "type": "string" },
        "risk_hint": {
          "type": "string",
          "enum": ["low", "medium", "high", "critical", "unknown"]
        }
      },
      "additionalProperties": true
    },
    "self_report_mismatch": {
      "type": "object",
      "required": ["reported", "actual", "description"],
      "properties": {
        "reported": { "type": "string" },
        "actual": { "type": "string" },
        "description": { "type": "string" },
        "risk_hint": {
          "type": "string",
          "enum": ["low", "medium", "high", "critical", "unknown"]
        }
      },
      "additionalProperties": false
    }
  },
  "additionalProperties": false
}
